<?xml version="1.0" encoding="UTF-8" standalone="no"?>
<!DOCTYPE Items SYSTEM "items.dtd">

<!-- item defaults - defines default item set in TeaseLib -->
<Items>
	<Toys>
		<Item item="Humbler" guid="humbler" displayName="My Humbler">
			<Attribute> Material.Wood </Attribute>
			<Attribute> Features.Lockable </Attribute>
			<Attribute> Sexuality.Sex.Male </Attribute>
		</Item>

		<Item item="Wrist_Restraints" guid="wrist_restraints" displayName="Wrist Restraints">
			<Attribute> Material.Leather </Attribute>
		</Item>

		<Item item="Wrist_Restraints" guid="handcuffs" displayName="Hand cuffs">
			<Attribute> Material.Metal </Attribute>
		</Item>
		
	</Toys>

	<Household>
		<Item item="Wooden_Spoon" guid="wooden_spoon" displayName="Wooden spoon">
			<Attribute> Material.Wood </Attribute>
		</Item>
	</Household>
	
	<Clothes>
		<Item item="Catsuit" guid="catsuit" displayName="Catsuit">
			<Attribute> Material.Rubber </Attribute>
		</Item>
	</Clothes>

	<Gadgets>
		<Item item="EStim_Controller" guid="estim_controller" displayName="EStim-Test-Entry">
		</Item>
	</Gadgets>
</Items>
