<?xml version="1.0" encoding="UTF-8"?>
<!DOCTYPE Items SYSTEM "items.dtd">

<!--item defaults - defines default item set in TeaseLib -->

<Items>
	<Toys>
		<Item item="Humbler" guid="humbler" displayName="Humbler">
		</Item>
	</Toys>

	<Household>
		<Item item="Wooden_Spoon" guid="wooden_spoon" displayName="Woodenspoon">
			<Attribute> Material.Wood </Attribute>
		</Item>
	</Household>
	
	<Clothes>
		<Item item="Catsuit" guid="catsuit" displayName="Catsuit">
		</Item>
	</Clothes>

	<Gadgets>
		<Item item="Computer_Controlled_EStim" guid="estim" displayName="Teaselib-enabled estim controller">
		</Item>
	</Gadgets>
</Items>