<?xml version="1.0" encoding="UTF-8" standalone="no"?>
<!DOCTYPE Items SYSTEM "items.dtd">

<!-- item defaults - defines default item set in TeaseLib -->
<Items>
	<Toys>
		<Item item="Humbler" guid="my_humbler" displayName="My Humbler">
			<Attribute>Material.Metal</Attribute>
			<Attribute> Features.Lockable </Attribute>
			<Attribute> Sexuality.Sex.Male </Attribute>
		</Item>

		<Item item="Dildo" guid="another_dildo" displayName="Another Dildo">
			<Attribute>Material.Rubber</Attribute>
		</Item>
	</Toys>
</Items>
